{
  "id": "ac-001",
  "storyId": "story-001",
  "description": "Given I am on the product listing page, when I select a category filter, then only products in that category are displayed",
  "format": "gherkin",
  "given": "I am on the product listing page",
  "when": "I select a category filter",
  "then": "only products in that category are displayed",
  "status": "passing",
  "order": 1,
  "createdAt": "2024-01-10T09:00:00Z"
}